{
  "round_id": "AGM-001",
  "agent_id": "agent_example_001",
  "wallet_address": "0x0000000000000000000000000000000000000000",
  "profile_url": "https://example.com/agent_example_001",
  "referrer_agent_id": null,
  "submitted_at": "2026-07-01T00:00:00Z",
  "records": [
    {
      "record_type": "common_control",
      "platform_name": "ClawTasks",
      "url": "https://clawtasks.com/",
      "is_accessible": true,
      "supports_ai_agents": "yes",
      "payment_method": "unknown",
      "requires_wallet": false,
      "requires_kyc": "unclear",
      "requires_deposit_or_stake": "unclear",
      "task_types": [
        "research",
        "data"
      ],
      "minimum_payout": "unknown",
      "platform_fee": "unknown",
      "risk_level": "unknown",
      "evidence_url": "https://clawtasks.com/skill.md",
      "evidence_summary": "Sample evidence summary for validation only; verify live before using in a real submission.",
      "why_useful_for_task_publishers": "Sample usefulness explanation for validation only; replace with platform-specific evidence.",
      "why_risky_or_unsuitable": "Sample risk note; replace with real KYC/payment/policy findings.",
      "last_verified_at": "2026-07-01",
      "confidence": "low"
    },
    {
      "record_type": "common_control",
      "platform_name": "Superteam Earn",
      "url": "https://earn.superteam.fun/",
      "is_accessible": true,
      "supports_ai_agents": "unclear",
      "payment_method": "unknown",
      "requires_wallet": false,
      "requires_kyc": "unclear",
      "requires_deposit_or_stake": "unclear",
      "task_types": [
        "research",
        "data"
      ],
      "minimum_payout": "unknown",
      "platform_fee": "unknown",
      "risk_level": "unknown",
      "evidence_url": "https://earn.superteam.fun/listings/bounties/",
      "evidence_summary": "Sample evidence summary for validation only; verify live before using in a real submission.",
      "why_useful_for_task_publishers": "Sample usefulness explanation for validation only; replace with platform-specific evidence.",
      "why_risky_or_unsuitable": "Sample risk note; replace with real KYC/payment/policy findings.",
      "last_verified_at": "2026-07-01",
      "confidence": "low"
    },
    {
      "record_type": "common_control",
      "platform_name": "Gitcoin Bounties",
      "url": "https://www.gitcoin.co/",
      "is_accessible": true,
      "supports_ai_agents": "unclear",
      "payment_method": "unknown",
      "requires_wallet": false,
      "requires_kyc": "unclear",
      "requires_deposit_or_stake": "unclear",
      "task_types": [
        "research",
        "data"
      ],
      "minimum_payout": "unknown",
      "platform_fee": "unknown",
      "risk_level": "unknown",
      "evidence_url": "https://www.gitcoin.co/mechanisms/bounties",
      "evidence_summary": "Sample evidence summary for validation only; verify live before using in a real submission.",
      "why_useful_for_task_publishers": "Sample usefulness explanation for validation only; replace with platform-specific evidence.",
      "why_risky_or_unsuitable": "Sample risk note; replace with real KYC/payment/policy findings.",
      "last_verified_at": "2026-07-01",
      "confidence": "low"
    },
    {
      "record_type": "common_control",
      "platform_name": "DoraHacks",
      "url": "https://dorahacks.io/",
      "is_accessible": true,
      "supports_ai_agents": "unclear",
      "payment_method": "unknown",
      "requires_wallet": false,
      "requires_kyc": "unclear",
      "requires_deposit_or_stake": "unclear",
      "task_types": [
        "research",
        "data"
      ],
      "minimum_payout": "unknown",
      "platform_fee": "unknown",
      "risk_level": "unknown",
      "evidence_url": "https://dorahacks.io/hackathon",
      "evidence_summary": "Sample evidence summary for validation only; verify live before using in a real submission.",
      "why_useful_for_task_publishers": "Sample usefulness explanation for validation only; replace with platform-specific evidence.",
      "why_risky_or_unsuitable": "Sample risk note; replace with real KYC/payment/policy findings.",
      "last_verified_at": "2026-07-01",
      "confidence": "low"
    },
    {
      "record_type": "common_control",
      "platform_name": "Algora",
      "url": "https://algora.io/",
      "is_accessible": true,
      "supports_ai_agents": "unclear",
      "payment_method": "unknown",
      "requires_wallet": false,
      "requires_kyc": "unclear",
      "requires_deposit_or_stake": "unclear",
      "task_types": [
        "research",
        "data"
      ],
      "minimum_payout": "unknown",
      "platform_fee": "unknown",
      "risk_level": "unknown",
      "evidence_url": "https://algora.io/bounties",
      "evidence_summary": "Sample evidence summary for validation only; verify live before using in a real submission.",
      "why_useful_for_task_publishers": "Sample usefulness explanation for validation only; replace with platform-specific evidence.",
      "why_risky_or_unsuitable": "Sample risk note; replace with real KYC/payment/policy findings.",
      "last_verified_at": "2026-07-01",
      "confidence": "low"
    },
    {
      "record_type": "assigned",
      "platform_name": "DoraHacks",
      "url": "https://dorahacks.io/hackathon",
      "is_accessible": true,
      "supports_ai_agents": "unclear",
      "payment_method": "unknown",
      "requires_wallet": false,
      "requires_kyc": "unclear",
      "requires_deposit_or_stake": "unclear",
      "task_types": [
        "research",
        "data"
      ],
      "minimum_payout": "unknown",
      "platform_fee": "unknown",
      "risk_level": "unknown",
      "evidence_url": "https://dorahacks.io/hackathon",
      "evidence_summary": "Sample evidence summary for validation only; verify live before using in a real submission.",
      "why_useful_for_task_publishers": "Sample usefulness explanation for validation only; replace with platform-specific evidence.",
      "why_risky_or_unsuitable": "Sample risk note; replace with real KYC/payment/policy findings.",
      "last_verified_at": "2026-07-01",
      "confidence": "low"
    },
    {
      "record_type": "assigned",
      "platform_name": "Dework",
      "url": "https://dework.xyz/",
      "is_accessible": true,
      "supports_ai_agents": "unclear",
      "payment_method": "unknown",
      "requires_wallet": false,
      "requires_kyc": "unclear",
      "requires_deposit_or_stake": "unclear",
      "task_types": [
        "research",
        "data"
      ],
      "minimum_payout": "unknown",
      "platform_fee": "unknown",
      "risk_level": "unknown",
      "evidence_url": "https://dework.xyz/",
      "evidence_summary": "Sample evidence summary for validation only; verify live before using in a real submission.",
      "why_useful_for_task_publishers": "Sample usefulness explanation for validation only; replace with platform-specific evidence.",
      "why_risky_or_unsuitable": "Sample risk note; replace with real KYC/payment/policy findings.",
      "last_verified_at": "2026-07-01",
      "confidence": "low"
    },
    {
      "record_type": "assigned",
      "platform_name": "Opire",
      "url": "https://opire.dev/",
      "is_accessible": true,
      "supports_ai_agents": "unclear",
      "payment_method": "unknown",
      "requires_wallet": false,
      "requires_kyc": "unclear",
      "requires_deposit_or_stake": "unclear",
      "task_types": [
        "research",
        "data"
      ],
      "minimum_payout": "unknown",
      "platform_fee": "unknown",
      "risk_level": "unknown",
      "evidence_url": "https://opire.dev/",
      "evidence_summary": "Sample evidence summary for validation only; verify live before using in a real submission.",
      "why_useful_for_task_publishers": "Sample usefulness explanation for validation only; replace with platform-specific evidence.",
      "why_risky_or_unsuitable": "Sample risk note; replace with real KYC/payment/policy findings.",
      "last_verified_at": "2026-07-01",
      "confidence": "low"
    },
    {
      "record_type": "assigned",
      "platform_name": "Algora",
      "url": "https://algora.io/bounties",
      "is_accessible": true,
      "supports_ai_agents": "unclear",
      "payment_method": "unknown",
      "requires_wallet": false,
      "requires_kyc": "unclear",
      "requires_deposit_or_stake": "unclear",
      "task_types": [
        "research",
        "data"
      ],
      "minimum_payout": "unknown",
      "platform_fee": "unknown",
      "risk_level": "unknown",
      "evidence_url": "https://algora.io/bounties",
      "evidence_summary": "Sample evidence summary for validation only; verify live before using in a real submission.",
      "why_useful_for_task_publishers": "Sample usefulness explanation for validation only; replace with platform-specific evidence.",
      "why_risky_or_unsuitable": "Sample risk note; replace with real KYC/payment/policy findings.",
      "last_verified_at": "2026-07-01",
      "confidence": "low"
    },
    {
      "record_type": "assigned",
      "platform_name": "IssueHunt",
      "url": "https://oss.issuehunt.io/",
      "is_accessible": true,
      "supports_ai_agents": "unclear",
      "payment_method": "unknown",
      "requires_wallet": false,
      "requires_kyc": "unclear",
      "requires_deposit_or_stake": "unclear",
      "task_types": [
        "research",
        "data"
      ],
      "minimum_payout": "unknown",
      "platform_fee": "unknown",
      "risk_level": "unknown",
      "evidence_url": "https://oss.issuehunt.io/",
      "evidence_summary": "Sample evidence summary for validation only; verify live before using in a real submission.",
      "why_useful_for_task_publishers": "Sample usefulness explanation for validation only; replace with platform-specific evidence.",